{
  "type": "sync",
  "id": "180bbc67-ed08-7846-a3d6-b82ada0b6f08",
  "creationDate": "2019-02-16T17:23:29.850Z",
  "version": 4,
  "application": {
    "architecture": "x86-64",
    "buildId": "20190213102848",
    "name": "Firefox",
    "version": "67.0a1",
    "displayVersion": "67.0a1",
    "vendor": "Mozilla",
    "platformVersion": "67.0a1",
    "xpcomAbi": "x86_64-gcc3",
    "channel": "nightly"
  },
  "payload": {
    "os": {
      "name": "Darwin",
      "version": "18.0.0",
      "locale": "en-CA"
    },
    "why": "schedule",
    "version": 1,
    "syncs": [
      {
        "when": 1550298047806,
        "took": 2077,
        "devices": [
          {
            "os": "Android",
            "version": "65.0.1",
            "id": "f38b5add46460b49c7373bac4c99f96bfda39af90ed01ce2b4b24957cd5bbeba"
          }
        ],
        "why": "schedule",
        "engines": [
          {
            "name": "clients",
            "took": 277
          },
          {
            "name": "tabs",
            "took": 6
          },
          {
            "name": "bookmarks",
            "took": 16
          },
          {
            "name": "forms",
            "took": 4
          },
          {
            "name": "history",
            "took": 394,
            "outgoing": [
              {
                "sent": 8
              }
            ]
          }
        ]
      },
      {
        "when": 1550301657882,
        "took": 2058,
        "devices": [
          {
            "os": "Android",
            "version": "65.0.1",
            "id": "f38b5add46460b49c7373bac4c99f96bfda39af90ed01ce2b4b24957cd5bbeba"
          }
        ],
        "why": "schedule",
        "engines": [
          {
            "name": "clients",
            "took": 624
          },
          {
            "name": "tabs",
            "took": 3
          },
          {
            "name": "bookmarks",
            "took": 12
          },
          {
            "name": "forms",
            "took": 5
          },
          {
            "name": "history",
            "took": 413,
            "outgoing": [
              {
                "sent": 8
              }
            ]
          }
        ]
      }
    ],
    "uid": "43720380d3e0935ca8d715b98d0da438",
    "deviceID": "0dd0695bf3753be0bf3de5f9809b145f68441b65bfeac85d89b31e04718bbaa6",
    "sessionStartDate": "2019-02-15T13:00:00.0-04:00",
    "histograms": {
      "PWMGR_BLOCKLIST_NUM_SITES": {
        "bucket_count": 10,
        "histogram_type": 0,
        "sum": 1,
        "range": [
          1,
          100
        ],
        "values": {
          "0": 0,
          "1": 1,
          "2": 0
        }
      },
      "PWMGR_NUM_SAVED_PASSWORDS": {
        "bucket_count": 50,
        "histogram_type": 0,
        "sum": 208,
        "range": [
          1,
          750
        ],
        "values": {
          "175": 0,
          "196": 1,
          "219": 0
        }
      }
    }
  }
}
